<?xml version="1.0" encoding="UTF-8"?>
<!ELEMENT class (teacher+,student+)>
<!ELEMENT teacher (fullname,subject,phone)>
<!ELEMENT student (fullname,age,phone)>
<!ELEMENT fullname (#PCDATA)>
<!ELEMENT subject (#PCDATA)>
<!ELEMENT age (#PCDATA)>
<!ELEMENT phone (#PCDATA)>


